{
  "version": "3.0.0",
  "philosophy": "537 hand-crafted reference roles spanning multiple domains of human work. Each role includes responsibilities, competencies, career progression, cross-functional relationships, and regional/industry variations. These are reference material — the AI constructs custom org structures for each request, using these roles as inspiration rather than prescription.",
  "regions": {
    "default": "na",
    "options": [
      "na",
      "emea",
      "apac",
      "latam"
    ],
    "detection": {
      "na": [
        "us",
        "usa",
        "united states",
        "canada",
        "north america",
        "american",
        "california",
        "new york",
        "silicon valley",
        "bay area",
        "toronto",
        "nyc"
      ],
      "emea": [
        "uk",
        "london",
        "europe",
        "eu",
        "germany",
        "berlin",
        "france",
        "paris",
        "netherlands",
        "amsterdam",
        "sweden",
        "stockholm",
        "spain",
        "italy",
        "middle east",
        "dubai",
        "africa",
        "nairobi",
        "copenhagen",
        "dublin",
        "zurich",
        "switzerland"
      ],
      "apac": [
        "china",
        "beijing",
        "shanghai",
        "shenzhen",
        "india",
        "bangalore",
        "mumbai",
        "japan",
        "tokyo",
        "korea",
        "seoul",
        "singapore",
        "australia",
        "sydney",
        "melbourne",
        "southeast asia",
        "indonesia",
        "vietnam",
        "thailand",
        "asia"
      ],
      "latam": [
        "brazil",
        "sao paulo",
        "mexico",
        "mexico city",
        "colombia",
        "bogota",
        "argentina",
        "buenos aires",
        "chile",
        "santiago",
        "latin america",
        "peru",
        "lima",
        "latam",
        "costa rica"
      ]
    }
  },
  "industries": {
    "default": "saas",
    "options": [
      "saas",
      "fintech",
      "healthcare",
      "manufacturing",
      "ecommerce"
    ],
    "detection": {
      "saas": [
        "saas",
        "software",
        "cloud",
        "b2b",
        "b2c saas",
        "subscription",
        "platform",
        "startup",
        "tech"
      ],
      "fintech": [
        "fintech",
        "finance",
        "banking",
        "payments",
        "insurance",
        "lending",
        "crypto",
        "blockchain",
        "neobank",
        "wealth"
      ],
      "healthcare": [
        "healthcare",
        "health",
        "biotech",
        "medical",
        "pharma",
        "hospital",
        "healthtech",
        "clinical",
        "life sciences"
      ],
      "manufacturing": [
        "manufacturing",
        "factory",
        "supply chain",
        "industrial",
        "automotive",
        "aerospace",
        "logistics",
        "physical product",
        "hardware"
      ],
      "ecommerce": [
        "ecommerce",
        "e-commerce",
        "retail",
        "d2c",
        "direct-to-consumer",
        "marketplace",
        "consumer goods",
        "wholesale",
        "shopify"
      ]
    }
  },
  "stages": {
    "default": "scaleup",
    "options": [
      "startup",
      "scaleup",
      "enterprise"
    ],
    "detection": {
      "startup": [
        "startup",
        "seed",
        "series a",
        "founding",
        "pre-revenue",
        "early stage",
        "vc-funded",
        "pre-seed"
      ],
      "scaleup": [
        "scaleup",
        "series b",
        "series c",
        "growing",
        "hypergrowth",
        "100 people",
        "post-revenue",
        "expansion"
      ],
      "enterprise": [
        "enterprise",
        "public company",
        "fortune",
        "inc 500",
        "multinational",
        "global",
        "corporation",
        "corp",
        "inc",
        "ltd",
        "ipo"
      ]
    }
  },
  "reference_roles": [
    "acad-anthropologist",
    "acad-archaeologist",
    "acad-economist",
    "acad-historian",
    "acad-linguist",
    "acad-philosopher",
    "acad-psychologist-research",
    "acad-sociologist",
    "agri-agronomist",
    "agri-beekeeper",
    "agri-conservationist",
    "agri-farmer",
    "agri-fisher",
    "agri-forester",
    "agri-greenhouse-manager",
    "agri-rancher",
    "agri-vineyard-manager",
    "art-art-therapist",
    "art-artist-in-residence",
    "art-ceramicist",
    "art-gallery-owner",
    "art-painter",
    "art-printmaker",
    "art-sculptor",
    "art-textile-artist",
    "avi-air-traffic-controller",
    "avi-aircraft-mechanic",
    "avi-airport-manager",
    "avi-avionics-technician",
    "avi-copilot",
    "avi-dispatcher-aviation",
    "avi-flight-attendant",
    "avi-flight-engineer",
    "avi-flight-school-instructor",
    "avi-ground-crew",
    "avi-pilot",
    "avi-ramp-agent",
    "beauty-barber",
    "beauty-cosmetologist",
    "beauty-esthetician",
    "beauty-hairstylist",
    "beauty-makeup-artist",
    "beauty-massage-therapist",
    "beauty-nail-tech",
    "beauty-piercer",
    "beauty-spa-manager",
    "beauty-tattoo-artist",
    "consult-business-analyst",
    "consult-change-manager",
    "consult-digital-transformation",
    "consult-implementation-lead",
    "consult-management-consultant",
    "consult-merger-integration",
    "consult-organization-design",
    "consult-strategy-consultant",
    "cre-actor",
    "cre-animator",
    "cre-art-critic",
    "cre-art-director",
    "cre-author",
    "cre-blogger",
    "cre-casting-director",
    "cre-character-designer",
    "cre-choreographer",
    "cre-cinematographer",
    "cre-columnist",
    "cre-composer",
    "cre-conservator",
    "cre-content-creator",
    "cre-copywriter",
    "cre-costume-designer",
    "cre-curator",
    "cre-editor",
    "cre-fact-checker",
    "cre-film-director",
    "cre-film-editor",
    "cre-film-producer",
    "cre-gallery-director",
    "cre-game-artist",
    "cre-game-designer",
    "cre-game-producer",
    "cre-game-programmer",
    "cre-graphic-designer",
    "cre-illustrator",
    "cre-influencer",
    "cre-interpreter",
    "cre-journalist",
    "cre-level-designer",
    "cre-lighting-designer",
    "cre-literary-agent",
    "cre-museum-director",
    "cre-music-director",
    "cre-music-producer",
    "cre-musician",
    "cre-narrative-designer",
    "cre-photographer",
    "cre-photojournalist",
    "cre-podcaster",
    "cre-production-designer",
    "cre-proofreader",
    "cre-publisher",
    "cre-qa-tester",
    "cre-screenwriter",
    "cre-set-designer",
    "cre-sound-designer",
    "cre-sound-engineer",
    "cre-storyboard-artist",
    "cre-streamer",
    "cre-theater-director",
    "cre-translator",
    "cre-videographer",
    "cre-vlogger",
    "cs-docs",
    "cs-self-service",
    "cs-success",
    "cs-tier1",
    "cs-tier2",
    "cs-tier3",
    "da-analyst",
    "da-bi",
    "da-engineer",
    "da-etl",
    "da-governance",
    "da-mlops",
    "da-reporting",
    "da-scientist",
    "dsg-brand",
    "dsg-design-ops",
    "dsg-motion",
    "dsg-research",
    "dsg-ui",
    "dsg-ux",
    "dsg-visual",
    "edu-chancellor",
    "edu-corporate-trainer",
    "edu-curriculum-developer",
    "edu-daycare-provider",
    "edu-dean",
    "edu-driving-instructor",
    "edu-esl-teacher",
    "edu-flight-instructor",
    "edu-guidance-counselor",
    "edu-instructional-designer",
    "edu-librarian",
    "edu-montessori-teacher",
    "edu-music-teacher",
    "edu-nanny",
    "edu-preschool-teacher",
    "edu-principal",
    "edu-professor",
    "edu-provost",
    "edu-registrar",
    "edu-school-board-member",
    "edu-school-psychologist",
    "edu-special-ed-teacher",
    "edu-substitute-teacher",
    "edu-superintendent",
    "edu-teacher",
    "edu-teaching-assistant",
    "edu-tutor",
    "edu-vocational-instructor",
    "energy-environmental-engineer",
    "energy-grid-operator",
    "energy-mining-engineer",
    "energy-nuclear-operator",
    "energy-oil-gas-worker",
    "energy-pipeline-operator",
    "energy-power-plant-operator",
    "energy-renewable-tech",
    "eng-arch",
    "eng-backend",
    "eng-data",
    "eng-devops",
    "eng-frontend",
    "eng-infrastructure",
    "eng-ml",
    "eng-mobile",
    "eng-platform",
    "eng-qa",
    "eng-sre",
    "exec-board",
    "exec-ceo",
    "exec-cfo",
    "exec-chief-staff",
    "exec-cmo",
    "exec-coo",
    "exec-cto",
    "exec-innovation",
    "fin-accounting",
    "fin-actuary",
    "fin-audit",
    "fin-budgeting",
    "fin-credit-analyst",
    "fin-financial-advisor",
    "fin-fpa",
    "fin-investor",
    "fin-loan-officer",
    "fin-procurement",
    "fin-stockbroker",
    "fin-tax",
    "fin-trader",
    "fin-treasury",
    "fin-underwriter",
    "fin-wealth-manager",
    "fun-cemetery-manager",
    "fun-embalmer",
    "fun-funeral-director",
    "fun-grief-counselor",
    "fun-mortician",
    "govt-budget-analyst-govt",
    "govt-city-planner",
    "govt-civil-servant",
    "govt-court-clerk",
    "govt-diplomat",
    "govt-ems-dispatcher",
    "govt-ethics-officer",
    "govt-firefighter",
    "govt-foreign-service",
    "govt-inspector",
    "govt-paramedic-govt",
    "govt-police-officer",
    "govt-policy-analyst",
    "govt-postal-worker",
    "govt-public-administrator",
    "govt-tax-examiner",
    "govt-urban-planner",
    "hlth-acupuncturist",
    "hlth-animal-caretaker",
    "hlth-audiologist",
    "hlth-chiropractor",
    "hlth-community-health-worker",
    "hlth-counselor",
    "hlth-dentist",
    "hlth-dietitian",
    "hlth-epidemiologist",
    "hlth-health-educator",
    "hlth-health-informaticist",
    "hlth-hospital-administrator",
    "hlth-lab-technician",
    "hlth-marriage-counselor",
    "hlth-medical-biller",
    "hlth-medical-records",
    "hlth-medical-transcriber",
    "hlth-midwife",
    "hlth-naturopath",
    "hlth-nurse",